{
  "lane_id": "HRDCP-03",
  "title": "Disability, accommodation, assistive technology, and contextual correction",
  "terminal_state": "disability_metric_mismatch_and_manual_correction_boundaries_recovered_named_accommodation_disposition_and_adverse_outcome_open",
  "observations": [
    {
      "id": "HRDCP-03-O01",
      "claim": "EEOC guidance gives an example in which a keystroke-based productivity algorithm could disadvantage a blind worker using voice-recognition software.",
      "source_ids": [
        "eeoc-visual-disability-ai"
      ],
      "state": "observed_official_technical_assistance",
      "limits": [
        "Illustrative guidance, not a named case finding."
      ]
    },
    {
      "id": "HRDCP-03-O02",
      "claim": "EEOC and DOJ warn that software and AI used for monitoring, pay, promotion and other employment decisions can create ADA screen-out risk.",
      "source_ids": [
        "eeoc-doj-ai-disability-warning"
      ],
      "state": "observed_official_agency_release",
      "limits": [
        "No named deployment misuse is established."
      ]
    },
    {
      "id": "HRDCP-03-O03",
      "claim": "EEOC guidance recommends explaining how technology evaluates workers and providing an accommodation path.",
      "source_ids": [
        "eeoc-visual-disability-ai"
      ],
      "state": "observed_official_technical_assistance",
      "limits": [
        "Promising practice language is retained as guidance."
      ]
    },
    {
      "id": "HRDCP-03-O04",
      "claim": "ICO monitoring guidance requires accuracy controls and says workers should be able to see, explain and challenge monitoring results used in adverse decisions.",
      "source_ids": [
        "ico-monitoring-workers"
      ],
      "state": "observed_current_regulatory_guidance",
      "limits": [
        "UK guidance under review; no case judgment."
      ]
    },
    {
      "id": "HRDCP-03-O05",
      "claim": "ICO biometric guidance requires manual review pathways and rapid restoration where automated access denial could cause lost pay or discipline.",
      "source_ids": [
        "ico-biometric-manual-review"
      ],
      "state": "observed_current_regulatory_guidance",
      "limits": [
        "Biometric-access context only."
      ]
    },
    {
      "id": "HRDCP-03-O06",
      "claim": "The Platform Work Directive bars automated inference of disability and health status and requires safety and psychosocial risk assessment.",
      "source_ids": [
        "eu-platform-work-directive-2024"
      ],
      "state": "observed_binding_directive_text",
      "limits": [
        "Platform-work scope and transposition boundary remain explicit."
      ]
    }
  ],
  "findings": [
    {
      "id": "HRDCP-03-F01",
      "claim": "A low activity or speed score can encode a tool, interface or disability mismatch rather than lower job capacity.",
      "source_ids": [
        "eeoc-visual-disability-ai",
        "ico-biometric-manual-review"
      ],
      "status": "independently_supported_scoped",
      "limits": [
        "No individual diagnosis or named causal conclusion."
      ]
    },
    {
      "id": "HRDCP-03-F02",
      "claim": "Accommodation must attach before adverse use of the metric; equal administration does not establish equal construct measurement.",
      "source_ids": [
        "eeoc-visual-disability-ai",
        "eeoc-doj-ai-disability-warning"
      ],
      "status": "legal_boundary_recovered",
      "limits": [
        "Exact legal duties remain jurisdiction- and fact-specific."
      ]
    },
    {
      "id": "HRDCP-03-F03",
      "claim": "Manual correction is meaningful only if it can restore access, pay, opportunity and the underlying record before downstream discipline propagates.",
      "source_ids": [
        "ico-biometric-manual-review",
        "ico-monitoring-workers"
      ],
      "status": "bounded_synthesis",
      "limits": [
        "Not a universal remedy rule."
      ]
    },
    {
      "id": "HRDCP-03-F04",
      "claim": "The worker-facing receipt should retain assistive technology, accommodation request, intended construct, disposition and alternative evidence as separate fields.",
      "source_ids": [
        "eeoc-visual-disability-ai",
        "ico-monitoring-workers"
      ],
      "status": "independently_supported_scoped",
      "limits": [
        "Protocol design, not adopted policy."
      ]
    }
  ],
  "open_questions": [
    "what_assistive_technology_or_disability_context_was_relevant",
    "what_construct_the_metric_claimed_to_measure",
    "when_the_accommodation_request_was_received_and_dispositioned",
    "whether_an_alternative_measure_was_available",
    "whether_access_pay_or_opportunity_was_restored_after_correction",
    "whether_the_model_was_revised_after_a_confirmed_mismatch"
  ],
  "schema_version": 1,
  "object_type": "dissonance_counterpower_lane",
  "authority": {
    "ai_caused_chloe_moffat_death_claims_allowed": false,
    "canonical_product_effects_allowed": false,
    "control_adoption_allowed": false,
    "dissonance_purge_universal_claims_allowed": false,
    "employer_liability_findings_allowed": false,
    "employer_specific_causation_findings_allowed": false,
    "final_coroner_conclusion_claims_allowed": false,
    "graph_effects_allowed": false,
    "individual_culpability_findings_allowed": false,
    "legal_conclusions_allowed": false,
    "named_company_intent_or_misuse_beyond_public_record_allowed": false,
    "parent_wave_mutation_allowed": false,
    "private_source_publication_allowed": false,
    "protected_activity_classification_claims_allowed": false,
    "publication_effects_allowed": false,
    "universal_prevalence_findings_allowed": false,
    "victim_character_inferences_allowed": false
  }
}
